{"name":"rust-microbatch","language":"rust","version":"stable","category":"microbatch","config":{"duration_sec":30,"batch_max":500,"window_ms":50,"concurrency":1000,"payload_bytes":64},"metrics":{"tps":62033.33,"p50_us":16032,"p99_us":16982,"p999_us":18407,"p9999_us":23173,"max_us":24158,"rss_mb":35.06,"alloc_mb_per_sec":0,"gc_pause_p99_us":0,"errors":0,"success":1861000},"timestamp":"2026-08-27T08:20:50+0800"}