{"name":"java-microbatch","language":"java","version":"17.0.18","category":"microbatch","config":{"duration_sec":30,"batch_max":500,"window_ms":50,"concurrency":8,"payload_bytes":64},"metrics":{"tps":142.13,"p50_us":56234,"p99_us":56885,"p999_us":62373,"p9999_us":64565,"max_us":64879,"rss_mb":41.34,"alloc_mb_per_sec":0,"gc_pause_p99_us":0,"errors":0,"success":4264},"timestamp":"2026-08-27T00:36:06+08:00"}